{
  "siteName": "글로벌 EV 노트",
  "tagline": "수입 전기차 제원·트림·가격과 액세서리를 모아 둔 비공식 안내",
  "updatedAt": "2026-09-11",
  "unofficial": true,
  "fx": {
    "eurKrw": 1563.3,
    "gbpKrw": 1813.3,
    "asOf": "2026-09-08",
    "eurKrwAsOf": "2026-09-04",
    "gbpKrwAsOf": "2026-09-08",
    "source": "EUR/KRW ValutaFX 종가(2026-09-04), GBP/KRW 시장 스냅샷(2026-09-08). 짐작용 환산이며 송금·카드 환율은 아니에요.",
    "sourceUrl": "https://www.valutafx.com/history/eur-krw-2026-09-04"
  }
}
